Geological_Feature,Setting,Process,Constraint_Type,Definition,Piles_Assessment,Suction_Caisson_Assessment,GBS_Assessment,Cables_Assessment,Dominant_Constraint,Comments
Alluvial fan,Fluvial,Lithology + Relief,Lithology + Relief,Cone-shaped forms with surface slopes radiating from apex where feeder channel splits to form distributary channels.,Higher Constraint,Higher Constraint,Higher Constraint,Higher Constraint,Active sedimentary system,"Exposure of fresh sediment in the alluvial fan at the confluence of the main river and its steep tributary provided an ongoing source of sediment that could be mobilised into the river system in any subsequent rainfall event (Reynolds et al., 2018)"
Back barrier,Coastal,Lithology,Lithology,Relatively protected area between barrier and mainland which may be occupied by flats or lagoon.,Moderate constraint,Higher Constraint,Higher Constraint,Moderate constraint,Shallow water depth,"A hard stratum overlying a weaker one presents a danger that may cause a foundation to punch through the softer sediments.

Exposure of near shore cables may result from coastal processes; increasing risk to cables from external threats. Cables can be protected via Horizontal drilling (HDD). "
Barrier,Coastal,Lithology,Lithology,Elongate accumulations of sand or coarser sediment deposited by waves and longshore currents rising above sea level.,Moderate constraint,Higher Constraint,Higher Constraint,Moderate constraint,Shallow water depth,Exposure or displacement of near shore cables may result from coastal processes; increasing risk to cables from external threats. Cables can be protected via Horizontal drilling (HDD). 
Basin / basin plain,Physiography,Relief,Relief,A depression more or less equidimensional in plan and of variable extent.,Moderate constraint,Higher Constraint,Higher Constraint,Moderate constraint,Soft soil units,Soft sediments likely to be deposited in deep basins 
Beach,Coastal,Lithology + Relief,Lithology + Relief,Wave-deposited body of sand or gravel formed along open coast marine estuarine and lacustrine shorelines.,Moderate constraint,Higher Constraint,Higher Constraint,Moderate constraint,Shallow water depth,Exposure or displacement of near shore cables may result from coastal processes; increasing risk to cables from external threats. Cables can be protected via Horizontal drilling (HDD). 
Bedrock outcrop (carbonate),Solid Earth,Lithology,Lithology,Relief formed by carbonate bedrock cropping out of seabed. Can have highly variable geotechnical properties.,Higher Constraint,Higher Constraint,Moderate constraint,Moderate constraint,Variable geotechnical properties,"Depending on the lithology and strength of the bedrock, pile driving may be successful however that would require significant weathering of rockhead to reduce the bedrock to strengths comparable with unlithified deposits (e.g., stiff clay characteristics). 

Cables must be surface-laid, increasing exposure to environmental and anthropogenic hazards. Sensitive benthic communities must be protected. "
Bedrock outcrop (igneous),Solid Earth,Lithology,Lithology,Relief formed by igneous bedrock cropping out of seabed surface.,Higher Constraint,Higher Constraint,Lower Constraint,Higher Constraint,Strong bedrock,"Bedrock close to seabed surface can be difficult to pile - other foundation methods required. Carbonate rock (including chalk) can have highly variable geotechnical properties, from putty-like (soil) to strong bedrock

Cables must be surface-laid, increasing exposure to environmental and anthropogenic hazards. Sensitive benthic communities must be protected."
Bedrock outcrop (metamorphic),Solid Earth,Lithology,Lithology,Relief formed by metamorphic bedrock cropping out of seabed surface.,Higher Constraint,Higher Constraint,Lower Constraint,Higher Constraint,Strong bedrock,"Bedrock close to seabed surface can be difficult to pile - other foundation methods required. 

Cables must be surface-laid, increasing exposure to environmental and anthropogenic hazards. Sensitive benthic communities must be protected."
Bedrock outcrop (sedimentary clastic),Solid Earth,Lithology,Lithology,Relief formed by clastic sedimentary bedrock cropping out of seabed surface.,Higher Constraint,Higher Constraint,Lower Constraint,Higher Constraint,Strong bedrock,"Bedrock close to seabed surface can be difficult to pile - other foundation methods required. 

Offshore the west coast of Scotland, palaeo-ice stream show the flow dirstion of ice and the formation of bedrock megagrooves at the seabed surface (Stoker and Bradwell, 2005). 

Cables must be surface-laid, increasing exposure to environmental and anthropogenic hazards. Sensitive benthic communities must be protected."
Bedrock outcrop (undifferentiated),Solid Earth,Lithology,Lithology,Relief formed by bedrock of unspecified lithology cropping out of surrounding seabed. Can be covered by thin sediment.,Higher Constraint,Higher Constraint,Lower Constraint,Higher Constraint,Strong bedrock - undifferentiated,"Bedrock close to seabed surface can be difficult to pile - other foundation methods required. 

Cables must be surface-laid, increasing exposure to environmental and anthropogenic hazards. Sensitive benthic communities must be protected."
Buried eustatic escarpment,Solid Earth,Relief,Relief,Escarpments formed by sea level standstills that can be totally or partially covered by transgressive sediment.,Moderate constraint,Moderate constraint,Higher Constraint,Moderate constraint,Uneven ground,Development implications will depend on the gradient of the seabed slope. 
Buried river valley,Fluvial,Lithology + Relief,Lithology + Relief,Form via combinations of fluvial and coastal processes widening by lateral erosion and lengthening by headward erosion.,Moderate constraint,Moderate constraint,Higher Constraint,Moderate constraint,Heterogeneous sediments,"Channel infill can have very different grain sizes and geotechnical properties to those of the surrounding deposits into which they are cut. Can lead to uneven distribution of loads beneath GBS, lateral variability in geotechnical values across the footprint of a monopile, heterogeneous (and coarse-grained) soils that negatively impact on suction caisson performance, reduced anchor penetration depths, and may require changes in cable & pipeline trenching approaches/tools due to the variability along the planned trenching route (the corridor).

Can be engineered around but must be accounted for in planning foundation design."
Buried tunnel valley,Glacial,Lithology + Relief,Lithology + Relief,A large subglacial steep-sided channel cut into unconsolidated sediment or bedrock by meltwater. May have reverse gradient in places.,Moderate constraint,Higher Constraint,Higher Constraint,Moderate constraint,Heterogeneous sediments,
Carbonate sands,Sediments,Lithology,Lithology,Calcareous and carbonate soils consisting partially or completely of calcium carbonate. Calcium carbonate is a relatively soft mineral compared with silica-based soils.,Moderate constraint,Moderate constraint,Moderate constraint,Moderate constraint,Crushable soil,"The crushability of carbonate grains make carbonate sands unreliable foundation materials (Murff, 1987; Jewell and Khorshid 2000; Kolk, 2000). Calcareous sands are difficult to classify and can be highly contractive. "
Clay tectonics,Post-depositional,Structure + Geohazard,Structure + Geohazard,Layer-bound arrays of normal faults confined to stratigraphic intervals typically in fine-grained sediments.,Higher Constraint,Moderate constraint,Moderate constraint,Moderate constraint,Unknown - potential fluid conduit,"Ongoing research regarding polygonal faulting - e.g., VLAIO funding ongoing in clay tectonics https://research.ugent.be/web/result/project/8180a538-a0fb-44f0-ab27-e414f933ece8/details/en and https://www.bluecluster.be/projects/clay-tectonics"
Coarse lag deposits,Marine,Lithology,Lithology,Coarse-grained material derived from Pleistocene glacial sediments modified during Holocene by winnowing and transport of finer fraction.,Moderate constraint,Moderate constraint,Higher Constraint,Lower Constraint,Coarse soil units,Potential for highly variable ground conditions and overconsolidation. Potential for obstructions such as cobble beds and boulders. Hard substate that may be difficult to penetrate. May require seabed preparation.
Coastal bar form,Coastal,Lithology,Lithology,Any type of barform formed in coastal setting such as nearshore bar berm shoreface terrace beach cusp.,Moderate constraint,Higher Constraint,Higher Constraint,Moderate constraint,Active sedimentary system,Exposure or displacement of near shore cables may result from coastal processes; increasing risk to cables from external threats. Cables can be protected via Horizontal drilling (HDD). 
Concretions,Post-depositional,Lithology,Lithology,Nodular growths of various minerals that form within host rock varying in size shape composition and distribution.,Moderate constraint,Higher Constraint,Higher Constraint,Moderate constraint,Boulders,"E.g., more than 10% of the Finnish marine areas (seabed) are covered by Ferromanganese concretions. They are often located on the sandy/silty seabed substrate, but subsurface sediment may also be fine, e.g. (glacial) clay (e.g., Finland)."
Delta,Coastal,Lithology,Lithology,Discrete shoreline sedimentary protuberance where river enters water body and supplies sediment rapidly.,Moderate constraint,Moderate constraint,Higher Constraint,Higher Constraint,Heterogeneous sediments,Exposure or displacement of near shore cables may result from coastal processes; increasing risk to cables from external threats. Cables can be protected via Horizontal drilling (HDD). 
Depositional zone (mass movement),Mass movement,Lithology + Relief,Lithology + Relief,Most downslope zone of mass movement within which displaced material lies above original ground surface.,Moderate constraint,Higher Constraint,Higher Constraint,Moderate constraint,Heterogeneous sediments,"In-situ MTDs (i.e., buried or at seabed surface, ancient) may be mapped in the subsurface and penetrated via CPTs to determine lithology

Present-day mass movement may cause impact damage to WTGs and cables (or lateral displacement inducing tensions or kinks)."
Depression / hole,Physiography,Relief,Relief,A general term for a closed-contour bathymetric low. Depressions vary in scale from small local features to larger basins.,Moderate constraint,Moderate constraint,Moderate constraint,Moderate constraint,Uneven ground,May require seabed preparation before installation of foundations.
Diamicton,Sediments,Lithology,Lithology,Superficial deposits,Moderate constraint,Higher Constraint,Moderate constraint,Moderate constraint,Overconsolidated clays,"Over consolidated clay or associated presence of boulder fields can cause challenges for construction (e.g., Finland)"
Erratic blocks (non-glacial),Mass movement,Lithology + Relief,Lithology + Relief,Large rock or boulder carried by rivers lateral drift or gravity transport contrasting with country rock.,Higher Constraint,Higher Constraint,Higher Constraint,Higher Constraint,Rafts or boulders,"In-situ MTDs (i.e., buried or at seabed surface, ancient) may be mapped in the subsurface and penetrated via CPTs to determine lithology.

Present-day mass movement may cause impact damage to WTGs and cables (or lateral displacement inducing tensions or kinks)"
Erratic or glaciotectonic raft,Glacial,Lithology + Relief,Lithology + Relief,Large rock or boulder carried by glacier or floating ice and deposited when ice melted well away from place of origin.,Higher Constraint,Higher Constraint,Higher Constraint,Higher Constraint,Rafts or boulders,"If unaccounted for, can provide significant challenge/constraint to most/all subsurface foundations (e.g., pile refusal / tip damage, damage / refusal or uneven emplacement of suction caisson and skirts for gravity base structures, cable/pipeline plough pop-up or deviation, poor penetration for drag embedment anchors). Significant and unexpected vertical and lateral variability in ground conditions incl. geotechnical parameters."
Esker,Glacial,Lithology + Relief,Lithology + Relief,Sinuous elongate ridges of glaciofluvial sands and gravels usually stratified and imbricated. Form by deposition from meltwater streams.,Moderate constraint,Higher Constraint,Higher Constraint,Moderate constraint,Heterogeneous sediments,"Typically comprise sand and gravel deposited by meltwater within or beneath an ice mass. Can be dense. Eskers are also possible resources for aggregates (e.g., Finland)."
Estuary,Coastal,Lithology + Relief,Lithology + Relief,Classified into fjord spit-enclosed drowned river valley funnel-shaped river valley embayment and tidal inlet.,Moderate constraint,Higher Constraint,Higher Constraint,Moderate constraint,Shallow water depth,"A hard stratum overlying a weaker one presents a danger that may cause a foundation to punch through the softer sediments.  

Exposure or displacement of near shore cables may result from coastal processes; increasing risk to cables from external threats. Cables can be protected via Horizontal drilling (HDD). "
Evacuation zone (mass movement),Mass movement,Lithology + Relief,Lithology + Relief,Most upslope zone of mass movement within which remobilized material lies below original ground surface.,Higher Constraint,Higher Constraint,Higher Constraint,Higher Constraint,>5 degree slope,"In-situ headscarps (i.e., buried or at seabed surface, ancient) may be mapped in the subsurface and penetrated via CPTs to determine lithology of sediments infilling the headscarp.  

Present-day mass movement may cause impact damage to WTGs and cables (or lateral displacement inducing tensions or kinks)."
Evaporites,Sediments,Lithology,Lithology,Any of a variety of individual minerals found in sedimentary deposits of soluble salts that results from evaporation of water. Can influence shallow structure.,Higher Constraint,Higher Constraint,Higher Constraint,Higher Constraint,Uneven ground,Can form doming features in the subsurface or at seabed (diapirs) and prone to moving
Firm to hard mud,Sediments,Lithology,Lithology,Superficial deposits,Moderate constraint,Higher Constraint,Moderate constraint,Moderate constraint,Homogenous sediments,Avoided soils for suction buckets.
Fractured bedrock,Solid Earth,Structure,Structure,Bedrock with multiple fractures or fracture networks causing discontinuities that can be exploited by erosion.,Higher Constraint,Higher Constraint,Higher Constraint,Higher Constraint,Uneven ground,"Depending on the original porosity of the host bedrock, the secondary porosity is controlled by the density of the fracture or discontinuity network. Fractures and joints may act as conduits for surface and ground water increasing likelihood of weathering resulting in variable ground conditions. Cables must be surface-laid, increasing exposure to environmental and anthropogenic hazards."
Glacifluvial delta,Glacial,Lithology + Relief,Lithology + Relief,Coarser-grained sediments with steep front slopes. Foreset beds generally dipping 10-30Â°. Glacier-fed deltas as terrestrial proglacial meltwater streams carry sediments.,Moderate constraint,Moderate constraint,Higher Constraint,Moderate constraint,Uneven ground / coarse soil units,"May require seabed preparation before installation of foundations. Variable soil units provide a challenge for suction caisson, particularly where potential thick gravel beds are interbedded with finer-grained soil units. Thick gravel beds can reduce friction along the outer surface. Potential for coarse gravel beds, and variability in soil profiles over the delta. This makes selecting a cable trenching tool more challenging as some tools can handle dense, coarse soil units whereas some cannot."
Glacifluvial outwash plain,Glacial,Lithology + Relief,Lithology + Relief,Laterally extensive flat plain of sand and gravel with braided streams of glacial meltwater flowing across them when active.,Moderate constraint,Moderate constraint,Higher Constraint,Moderate constraint,Uneven ground / coarse soil units,"Variable soil units provide a challenge for suction caisson, particularly where potential thick gravel beds are interbedded with finer-grained soil units. Thick gravel beds can reduce friction along the outer surface. Potential for coarse gravel beds, and variability in soil profiles over the Sandur. This makes selecting a cable trenching tool more challenging as some tools can handle dense, coarse soil units whereas some cannot."
Glaciolacustrine,Glacial,Lithology,Lithology,Stratified sediments that display rhythmic or cyclic repetition of beds that form in subaqueous settings such as lakes and oceans.,Moderate constraint,Moderate constraint,Higher Constraint,Moderate constraint,Soft sediments," Ice-dammed lakes typically form massive deposits of soft clay. 

A hard stratum overlying a weaker one presents a danger that may cause a foundation to punch through the softer sediments."
Glauconite,Sediments,Lithology,Lithology,Glauconite is an iron potassium mica with a characteristically green colour and low strength often found in peloidal form. Transforms into fine-grained soil upon shearing due to particle crushing.,Higher Constraint,Higher Constraint,Higher Constraint,Moderate constraint,Crushable soil,Crushing of glauconite results in high pile friction and transition from sand to clay-like behaviour. May result in pile fatigue or refusal. Difference in properties between allogenic (reworked) vs. authogenic (insitu). Reworked glauconite can wash away weaker minerals. 
Gravel,Sediments,Lithology,Lithology,Superficial deposits,Moderate constraint,Higher Constraint,Higher Constraint,Moderate constraint,Coarse soil units,Hard substate that may be difficult to penetrate.
Grounding zone wedge,Glacial,Lithology + Relief,Lithology + Relief,Sedimentary depocentre formed at grounding zone of icesheet/ice-shelf system formed of dipping diamicton beds overlain by horizontal sheets.,Higher Constraint,Higher Constraint,Higher Constraint,Higher Constraint,Overconsolidated clays / extremely dense sands,"Variable soil conditions which may include heavily overconsolidated subglacial tills. Diamicton can be clast-rich, with cobble to boulder-sized clasts, unfavourable for most/all subsurface structures. May prove problematic for suction caisson where soil heterogeneity is unfavourable. Where present near-surface (e.g., <5 m sediment cover above), may prove problematic for certain cable/pipeline trenching equipment."
Hill-hole pair,Glacial,Lithology + Relief,Lithology + Relief,A discrete hill of ice-thrust material situated down glacier from a depression of approximately the same size and shape.,Moderate constraint,Moderate constraint,Moderate constraint,Moderate constraint,Uneven ground,"Potential for bedrock, restricting pile driving. Uneven surface with variable slope angles for GBS. Variable, deformed ground conditions unsuitable for suction caisson. Variable slope angles and lateral variability for cable and pipeline trenching, incl. possible encountering bedrock at seabed."
Hummocky terrain,Glacial,Lithology,Lithology,A landscape with highly irregular surface characterised by series of small mounds ridges and depressions. Associated with glacier/ice sheet grounding zones.,Moderate constraint,Higher Constraint,Higher Constraint,Moderate constraint,Heterogeneous sediments,
Hydrothermal vent,Fluid flow,Geohazard + Relief,Geohazard + Relief,Fissures on oceanic crust in volcanically active sites from which geothermally heated water is released.,Higher Constraint,Higher Constraint,Higher Constraint,Higher Constraint,Active fluid flow,Not possible to develop on sites
Iceberg ploughmark,Glacial,Lithology,Lithology,Groove or furrow caused by impact and movement of grounded icebergs along the sea or lake floor.,Lower Constraint,Lower Constraint,Higher Constraint,Lower Constraint,Uneven ground,May require seabed preparation before installation of foundations.
Ice-contact delta,Glacial,Lithology + Relief,Lithology + Relief,Ice-contact deltas form at glacier margins and develop from ice proximal grounding line fans or other submerged depositional units.,Moderate constraint,Moderate constraint,Higher Constraint,Moderate constraint,Uneven ground,"May require seabed preparation before installation of foundations. Variable soil units provide a challenge for suction caisson, particularly where potential thick gravel beds are interbedded with finer-grained soil units. Thick gravel beds can reduce friction along the outer surface. Potential for coarse gravel beds, and variability in soil profiles over the delta. This makes selecting a cable trenching tool more challenging as some tools can handle dense, coarse soil units whereas some cannot."
Interbedded sediments,Sediments,Lithology,Lithology,Superficial deposits,Moderate constraint,Higher Constraint,Higher Constraint,Moderate constraint,Interbedded sediments,"The level of Constraint will depend on the thickness, soil type and consistency (strength) of the soil and therefore these 'Constraint' levels are indicative only. 

Interbedded layers of soft/hard material can cause differential settlement. "
Kettle hole,Glacial,Lithology + Relief,Lithology + Relief,Steep-sided hollow produced by melt-out of original deposit which also contained finer materials removed by wind or water action.,Moderate constraint,Moderate constraint,Higher Constraint,Moderate constraint,Uneven ground,May be infilled with soils of varying geotechnical properties compared with the surrounding units into which they are emplaced. Can also contain peat so potential for shallow gas. Can be engineered around but must be accounted for in planning foundation design.
Marine bar form,Marine,Lithology + Relief,Lithology + Relief,Larger than current-induced bedforms often forced by macro-scale topography and develop over longer periods of time.,Higher Constraint,Higher Constraint,Higher Constraint,Higher Constraint,Active sedimentary system,"Indicative of mobile sediments. Mobility may remove sediment from around the foundation and buried skirt, anchor, or conversely may increase lateral loading on side of foundation. Mobility may remove sediment overlying the buried cable which will leave it at risk from anchor interactions, and conversely may increase the sediment volume overlying the buried cable which can result in the cable exceeding the thermal threshold and hotspots developing."
MDAC outcropping,Fluid flow,Lithology,Lithology,Exposed authigenic carbonate structures associated with seepage of methane rich fluids.,Moderate constraint,Higher Constraint,Moderate constraint,Moderate constraint,Hard substrate,"Channel infill can have very different grain sizes and geotechnical properties to those of the surrounding deposits into which they are cut. Can lead to uneven distribution of loads beneath GBS, lateral variability in geotechnical values across the footprint of a monopile, heterogeneous (and coarse-grained) soils that negatively impact on suction caisson performance, reduced anchor penetration depths, and may require changes in cable & pipeline trenching approaches/tools due to the variability along the planned trenching route (the corridor).

Can be engineered around but must be accounted for in planning foundation design."
Meltwater channel,Glacial,Lithology + Relief,Lithology + Relief,A channel produced by the flow of glacial meltwater. Pressurized water may flow upslope as well as downslope producing undulating channel.,Moderate constraint,Higher Constraint,Higher Constraint,Moderate constraint,Heterogeneous sediments,May require seabed preparation before installation of foundations.
Moat,Physiography,Relief,Relief,An annular or partially annular bathymetric low typically located at the base of isolated raised features.,Moderate constraint,Moderate constraint,Moderate constraint,Moderate constraint,Uneven ground,Potential for highly variable ground conditions and overconsolidation. Potential for obstructions such as cobble beds and boulders.
Moraine,Glacial,Lithology + Relief,Lithology + Relief,A mound ridge or other distinct accumulation of generally unsorted unstratified glaciogenic sediment predominantly till.,Moderate constraint,Higher Constraint,Higher Constraint,Moderate constraint,>5 degree slope / heterogeneous sediments,May require seabed preparation before installation of foundations.
Mound,Physiography,Relief,Relief,A distinct elevation with rounded profile generally less than 500 m above surrounding relief. Sides are usually steeper than 5 degrees.,Moderate constraint,Moderate constraint,Moderate constraint,Moderate constraint,Uneven ground,Geohazard if active. Geohazard considered where dynamic geological event or process that is a risk to development. 
Mud volcano,Fluid flow,Geohazard + Relief,Geohazard + Relief,Positive topographic unit usually conical formed by periodic upwelling of sediments fluidised by gas and water.,Higher Constraint,Higher Constraint,Higher Constraint,Higher Constraint,Active fluid flow,Active sedimentary system 
Open river valley,Fluvial,Lithology + Relief,Lithology + Relief,Active river valleys form via fluvial and coastal processes with ongoing erosion and deposition.,Higher Constraint,Higher Constraint,Higher Constraint,Higher Constraint,Active sedimentary system,"Outer silver Pit, Well Hole, Markham's Hole, Sole Pit and Silver Pit in the offshore UK sector are examples of this - steep and possibly unstable sides and deep(er) water."
