Geological_Feature,Setting,Process,Constraint_Type,Definition,Piles_Assessment,Suction_Caisson_Assessment,GBS_Assessment,Cables_Assessment,Dominant_Constraint,Comments
Open tunnel valley,Glacial,Lithology + Relief,Lithology + Relief,A large subglacial steep-sided channel cut into unconsolidated sediment or bedrock by meltwater.,Higher Constraint,Higher Constraint,Higher Constraint,Higher Constraint,>5 degree slope,Creates a hard surface that is recognised as a special habitat that must be preserved. Potential fluid flow to determine if current or past fluid flow.
Peat (organic-rich),Sediments,Lithology,Lithology,Superficial deposits. Type of soil formed by the partial decomposition of vegetation matter. Includes submerged forests.,Higher Constraint,Higher Constraint,Higher Constraint,Higher Constraint,Organic soils,"Organic soils can also be associated with biogenic gas due to the breakdown of organic matter. Fibrous peats have the ability to reinforce soils, causing issues for cable trenching works, and can also provide fluid migration pathways."
Plateau / topographic high,Physiography,Relief,Relief,A generally closed-contoured relatively flat-topped bathymetric high with one or more relatively steep sides.,Moderate constraint,Higher Constraint,Higher Constraint,Moderate constraint,>5 degree slope,May require seabed preparation before installation of foundations.
Pockmark (field),Fluid flow,Geohazard + Relief,Geohazard + Relief,Multiple pockmarks mapped over one area indicating field of gas/fluid expulsion features.,Moderate constraint,Moderate constraint,Moderate constraint,Moderate constraint,Active fluid flow,Multiple pockmarks mapped over one area. This data entry indicates that individual pockmarks are not mapped - would require further investigation. Pockmarks only considered geohazard if active. Geohazard considered where dynamic geological event or process that is a risk to development. 
Pockmark (individual),Fluid flow,Geohazard + Relief,Geohazard + Relief,Concave crater-like depression formed by gas and/or fluid expulsion typically tens of meters in diameter.,Higher Constraint,Higher Constraint,Higher Constraint,Higher Constraint,Active fluid flow,Individually mapped pockmarks. Pockmarks only considered geohazard if active. Geohazard considered where dynamic geological event or process that is a risk to development. 
Reefs (ancient/present),Biogenic,Lithology + Relief,Lithology + Relief,In-situ positive relief persistent build-ups of skeleton-supported framework that influence local sedimentary environment.,Higher Constraint,Higher Constraint,Higher Constraint,Moderate constraint,Active sedimentary system / hardground,"Kaskela, A. & Rinne, H. 2018: Vedenalaisten Natura-luontotyyppien mallinnus Suomen merialueella (In Finnish). Geological Survey of Finland, Research report 6/2018, 36 p.
Rinne, H., Kaskela, A., Downie, A.-L., Tolvanen, H., von Numers, M., Mattila, J., 2014. Predicting the occurrence of rocky reefs in a heterogeneous archipelago area with limited data. Estuar. Coast. Shelf Sci. 138, 90–100."
Ridge,Physiography,Relief,Relief,An elongated elevation of varying height size and gradient. Variable steepness but usually has sloping sides greater than 5 degrees.,Moderate constraint,Moderate constraint,Moderate constraint,Moderate constraint,Uneven ground,May require seabed preparation before installation of foundations.
Rocky coast,Coastal,Lithology,Lithology,Any length of coast predominantly characterised by rock rather than sediment or vegetation.,Higher Constraint,Higher Constraint,Higher Constraint,Moderate constraint,Shallow water depth,"Boulders can occur occasionally, especially in the areas of Rapakivi granite bedrock, and De Geer moraine fields (e.g., Finland). 

Exposure of near shore cables may result from coastal processes; increasing risk to cables from external threats. Cables can be protected via Horizontal drilling (HDD). "
Salt/shale domes,Post-depositional,Lithology + Relief,Lithology + Relief,Positive feature on salt diapir covered by sediment pile that can be unstable due to halokinetic dynamics.,Moderate constraint,Moderate constraint,Moderate constraint,Moderate constraint,Uneven ground,Present-day sands may be related to mobile sediments. Dense sands could be problematic for suction buckets. Loose sands would be problematic for GBS.
Sand,Sediments,Lithology,Lithology,Superficial deposits,Lower Constraint,Moderate constraint,Higher Constraint,Lower Constraint,Homogenous sediments,"Unsuitable for all infrastructure types due to typically deep water settings, steep slopes, extremely strong lithologies, and associated hazards (e.g., seismic activity)."
Seamount,Solid Earth,Relief,Relief,Geographically isolated topographic unit on seafloor taller than 1000 m. Most formed by igneous activity.,Higher Constraint,Higher Constraint,Higher Constraint,Higher Constraint,Volcano / >5 degree slope,Flat-topped stable banks can be developed - however margins of banks may have steep slopes
Sediment bank/Bank crest,Marine,Relief,Relief,Formed by interactions between current instabilities and unconsolidated sediment at seabed. Require rapid current flows and high sediment supply.,Moderate constraint,Higher Constraint,Higher Constraint,Higher Constraint,Uneven ground,"May require scour mitigation measures if mobile sediments. Mobility may remove sediment overlying the buried cable which will leave it at risk from anchor interactions, and conversely may increase the sediment volume overlying the buried cable which can result in the cable exceeding the thermal threshold and hotspots developing. Requires monitoring to ensure burial depth/ exposure is considered. "
Sediment waves/dunes,Marine,Lithology,Lithology,Transverse bedforms larger than ripples with broad range of morphologies representing sediment transport.,Moderate constraint,Moderate constraint,Higher Constraint,Higher Constraint,Active sedimentary system,"Can lead to blowouts when drilling. Blowout Preventers (BOPs) are required for drilling in potentially gassy soils. Difficult to engineer around, avoidance is typically the main approach to de-risking developments in areas of gassy soils. Geohazard considered where dynamic geological event or process that is a risk to development. "
Shallow gas,Fluid flow,Geohazard,Geohazard,Presence of shallow biogenic or hydrocarbon-originated gas charged sediment above pressure containment depth.,Higher Constraint,Higher Constraint,Higher Constraint,Higher Constraint,Active fluid flow,"May require seabed preparation before installation of foundations, however if steep slopes then the site is likely going to be problematic to develop. Cables have ability to "
Shelf break,Physiography,Relief,Relief,The line along which there is marked increase in slope at the seaward margin of a shelf.,Higher Constraint,Higher Constraint,Higher Constraint,Moderate constraint,>5 degree slope,A hard stratum overlying a weaker one presents a danger that may cause a foundation to punch through the softer sediments. Interbedded layers of soft/hard material can cause differential settlement. 
Soft interbedded sediment,Sediments,Lithology,Lithology,Superficial deposits,Moderate constraint,Higher Constraint,Higher Constraint,Moderate constraint,Soft sediments,"A hard stratum overlying a weaker one presents a danger that may cause a foundation to punch through the softer sediments. Low strength means soft muds will not bear large loads. Acid sulphate soils (ASS) may contain harmful substances affecting cables, when exposed and/or dredged in coastal areas (Finland)."
Soft mud,Sediments,Lithology,Lithology,May include marine mud basins including soft glaciolacustrine/glaciomarine mud deposition or other soft muddy deposits.,Higher Constraint,Higher Constraint,Higher Constraint,Higher Constraint,Soft sediments,"Similar to moraines, there is a potential for vertical and lateral variability across and beneath these landforms. As they have experienced ice loading, they may consist of overconsolidated soil units and may contain cobble to boulder sized clasts. Drumlins can be comprised of sediment or bedrock and would require to be assessed individually.  "
Streamlined landform,Glacial,Lithology + Relief,Lithology + Relief,Streamlined landforms sculpted by glacier ice moving in coherent direction. Can consist of bedrock unconsolidated sediments or both.,Moderate constraint,Higher Constraint,Higher Constraint,Moderate constraint,Variable geotechnical properties,"Typically extremely dynamic environments incl. sediment gravity flows / landslides, internal tides with high current velocities, mobile bedforms. Bedrock is often exposed along steep canyon flanks and terraces, also leading to very variable ground conditions. High water depths make submarine canyons unsuitable for all fixed foundations, and very unfavourable for anchoring systems. May be used for cables and pipelines but comprehensive due diligence / hazard assessments must be undertaken."
Submarine canyon,Marine,Lithology + Relief,Lithology + Relief,Steep-sided generally V-shaped valleys with heads at or near continental shelf edge extending across continental slope.,Higher Constraint,Higher Constraint,Higher Constraint,Higher Constraint,Active sedimentary system,"Highly dynamic setting with mass flows that can damage / sever subsea cables and pipelines. Typically found along steep slopes (e.g., continental margins) and therefore not suitable for any foundation type. Typically found in deeper water environments, and therefore less favourable for fixed foundations."
Submarine channel,Marine,Lithology + Relief,Lithology + Relief,Formed by sediment-laden turbidity currents and other sediment-rich gravity currents or by fluvial incision during low-stands.,Higher Constraint,Higher Constraint,Higher Constraint,Higher Constraint,Active sedimentary system,"Highly dynamic setting with mass flows that can damage / sever subsea cables and pipelines. Typically found along continental margins down to abyssal plains and therefore not suitable for any foundation type. Typically found in deeper water environments, and therefore unsuitable for fixed foundations and very unfavourable for anchors."
Submarine delta - active,Marine,Lithology + Relief,Lithology + Relief,Submarine tidal deltas develop from nearshore to shelf break or submerged coastal riverine/estuarine deltas.,Higher Constraint,Higher Constraint,Higher Constraint,Higher Constraint,Active sedimentary system,"Highly dynamic setting with mass flows that can damage / sever subsea cables and pipelines. Typically found along continental margins down to abyssal plains and therefore not suitable for any foundation type. Typically found in deeper water environments, and therefore unsuitable for fixed foundations and very unfavourable for anchors."
Submarine delta - inactive,Marine,Lithology + Relief,Lithology + Relief,Inactive buried submarine tidal deltas and pro-delta deposits no longer receiving active sediment input.,Moderate constraint,Higher Constraint,Higher Constraint,Higher Constraint,Heterogeneous sediments,Active sedimentary system 
Submarine fan,Marine,Lithology + Relief,Lithology + Relief,Develop on continental slope rise and abyssal plain normally at mouths of submarine canyons constructed from sediment gravity flows.,Higher Constraint,Higher Constraint,Higher Constraint,Higher Constraint,Active sedimentary system,"Inactive, buried system may have heterogeneous sediments"
Submarine gully,Marine,Lithology + Relief,Lithology + Relief,Small-scale confined channels generally tens of meters deep and often linear. Commonly found within submarine canyons.,Higher Constraint,Higher Constraint,Higher Constraint,Higher Constraint,Active sedimentary system,Can pose a serious risk to the lives of those onboard the installation vessel. Can result in the complete loss of a foundation. Hard substrate so could cause abrasion of surface-laid cables and pipelines.
Submerged carbonate karst,Karst,Lithology,Lithology,Submerged landscape where dominant process was dissolution of carbonate rocks characterised by caves dolines.,Higher Constraint,Higher Constraint,Higher Constraint,Higher Constraint,Uneven ground,Can pose a serious risk to the lives of those onboard the installation vessel. Can result in the complete loss of a foundation. Hard substrate so could cause abrasion of surface-laid cables and pipelines.
Submerged salt karst,Karst,Lithology,Lithology,Submerged landscape where dominant process was dissolution of salt characterised by rough terrain and dolines.,Higher Constraint,Higher Constraint,Higher Constraint,Higher Constraint,Uneven ground,"Salt flowage seems to be one of the main mechanisms leading to folding and faulting of the late Miocene through Quaternary in Deep Algarve, Do?ana, Cadiz and Sanlucar basins (Hern?ndez-Molina et al., 2016)"
Submerged sandstone karst,Karst,Lithology,Lithology,Submerged landscape where dominant processes were chemical weathering and erosional processes of sandstone.,Higher Constraint,Higher Constraint,Higher Constraint,Higher Constraint,Uneven ground,Can pose a serious risk to the lives of those onboard the installation vessel. Can result in the complete loss of a foundation. Hard substrate so could cause abrasion of surface-laid cables and pipelines.
Tectonic depression,Solid Earth,Relief,Relief,Depression generated by unspecified tectonic/structural process. Includes graben basin half graben.,Higher Constraint,Higher Constraint,Higher Constraint,Higher Constraint,>5 degree slope,Would have to be assessed on a site-by-site basis
Tectonic escarpment,Solid Earth,Relief,Relief,An escarpment that forms as result of unspecified faulting activity.,Higher Constraint,Higher Constraint,Higher Constraint,Higher Constraint,>5 degree slope,"Unsuitable for all infrastructure types due to vertical and lateral variation, presence of bedrock (generally unfavourable) and associated hazards (e.g., seismic activity). Faults only considered geohazard if active. Geohazard considered where dynamic geological event or process that is a risk to development - e.g., pipeline rupture."
Tectonic lineament (fault),Solid Earth,Structure + Geohazard,Structure + Geohazard,Discrete surface or zone of surfaces expressed as fractures at seabed separating rock masses.,Higher Constraint,Higher Constraint,Higher Constraint,Higher Constraint,Faults / potential seismicity,"Unsuitable for all infrastructure types due to typically steep slopes, strong lithologies, and associated hazards (e.g., seismic activity)."
Terrace,Physiography,Relief,Relief,A flat or gently sloping region generally long and narrow bounded along one edge by steeper slope. Usually less than two degrees.,Moderate constraint,Moderate constraint,Moderate constraint,Moderate constraint,Uneven ground,May require seabed preparation before installation of foundations. Terraces likely to have steeper slopes than mounds
Tidal flat,Coastal,Lithology,Lithology,Low gradient intertidal to supratidal surfaces formed in fine-grained sediment.,Moderate constraint,Higher Constraint,Higher Constraint,Moderate constraint,Shallow water depth,"A hard stratum overlying a weaker one presents a danger that may cause a foundation to punch through the softer sediments. 

Exposure of near shore cables may result from coastal processes; increasing risk to cables from external threats. Cables can be protected via Horizontal drilling (HDD). "
Trough,Physiography,Relief,Relief,A long depression generally wide and flat-bottomed with symmetrical and parallel sides. Sides usually steeper than 5 degrees.,Moderate constraint,Moderate constraint,Moderate constraint,Moderate constraint,Uneven ground,"May require seabed preparation before installation of foundations. Sometimes, troughs can be dynamic environments and mobile sediments can be present."
U-shaped valley (Fjord),Glacial,Relief,Relief,A valley having pronounced parabolic cross-profile with steep parallel walls and broad nearly flat floor carved by glacial erosion.,Higher Constraint,Higher Constraint,Higher Constraint,Higher Constraint,>5 degree slope,"Can be prone to avalanches, ice, natural hazards and vulnerable to inclement weather that can take down transmission lines (Barajas, 2019)."
Volcano or volcanic feature,Solid Earth,Geohazard,Geohazard,Mountain or hill typically conical having crater or vent through which lava rock fragments hot vapour and gas are erupted.,Higher Constraint,Higher Constraint,Higher Constraint,Higher Constraint,Volcano,"Unsuitable for all infrastructure types due to typically deep water settings, steep slopes, extremely strong lithologies, and associated hazards (e.g., seismic activity). Geohazard considered where dynamic geological event or process that is a risk to development. "
